{
  "schemaVersion": 1,
  "name": "safe-refactor-composition",
  "version": "1.0.0",
  "source": {
    "registrySha256": "ef809274ef4cf856e543fb381bd0e0f358d61b138126ef7faf0aeed8d588d7a3",
    "memberTreeSha256": "d279ff05d17ade5488bd7e4961a6a36477aab4a3cfc6398d3b06d934beb7e258",
    "suitePath": "evals/packs/safe-refactor.json"
  },
  "pack": {
    "name": "safe-refactor",
    "version": "1.0.0",
    "members": [
      { "name": "code-review", "version": "1.0.0" },
      { "name": "codebase-exploration", "version": "1.0.1" },
      { "name": "refactoring-and-dead-code-removal", "version": "1.0.0" },
      { "name": "test-driven-development", "version": "1.0.0" },
      { "name": "verification-before-completion", "version": "1.0.1" }
    ],
    "handoffs": [
      { "from": "codebase-exploration", "to": "test-driven-development" },
      { "from": "test-driven-development", "to": "refactoring-and-dead-code-removal" },
      { "from": "refactoring-and-dead-code-removal", "to": "code-review" },
      { "from": "code-review", "to": "verification-before-completion" }
    ]
  },
  "adapter": {
    "id": "deterministic-pack-fixture-v1",
    "kind": "fixture",
    "entrypointSha256": "f6a5a32dc30f827056775878082795e76922f35ce6fd3584f9eb01b117cb66cb",
    "policySha256": "00aedb8508949b1740c12d07135f27deac65a9f7657699a405d1ed5dfa9b4971",
    "launchPolicySha256": "54fcd0e8eb7ac56d027031e65150a9a7592264a6e1e97fd67aae548b30226a81"
  },
  "trials": 3,
  "thresholds": null,
  "cases": [
    { "id": "refactor-c01", "split": "training", "kind": "positive", "prompt": "Map the unfamiliar caching subsystem, locate the controlling code path, conventions, tests, and cheapest validation command without editing.", "expected": ["codebase-exploration"], "excluded": ["test-driven-development"], "handoff": null },
    { "id": "refactor-c02", "split": "validation", "kind": "positive", "prompt": "Write a failing behavior test that establishes the cache preservation boundary before changing structure.", "expected": ["test-driven-development"], "excluded": ["codebase-exploration", "refactoring-and-dead-code-removal"], "handoff": { "from": "codebase-exploration", "to": "test-driven-development" } },
    { "id": "refactor-c03", "split": "validation", "kind": "positive", "prompt": "Perform the behavior-preserving refactor in mechanical steps and remove only code proven dead while tests remain green.", "expected": ["refactoring-and-dead-code-removal"], "excluded": ["test-driven-development", "code-review"], "handoff": { "from": "test-driven-development", "to": "refactoring-and-dead-code-removal" } },
    { "id": "refactor-c04", "split": "validation", "kind": "positive", "prompt": "Review the completed patch for correctness, regressions, unsafe deletion, and missing tests.", "expected": ["code-review"], "excluded": ["refactoring-and-dead-code-removal", "verification-before-completion"], "handoff": { "from": "refactoring-and-dead-code-removal", "to": "code-review" } },
    { "id": "refactor-c05", "split": "validation", "kind": "positive", "prompt": "Run the final verification commands and provide fresh evidence that the refactor preserved behavior.", "expected": ["verification-before-completion"], "excluded": ["code-review"], "handoff": { "from": "code-review", "to": "verification-before-completion" } },
    { "id": "refactor-c06", "split": "validation", "kind": "near-miss", "prompt": "The controlling code path is still unknown; produce a read-only repository map before writing any failing behavior test.", "expected": ["codebase-exploration"], "excluded": ["test-driven-development"], "handoff": { "from": "codebase-exploration", "to": "test-driven-development" } },
    { "id": "refactor-c07", "split": "validation", "kind": "near-miss", "prompt": "The failing behavior test does not yet prove the preservation boundary; stay in red-green-refactor and do not restructure code.", "expected": ["test-driven-development"], "excluded": ["refactoring-and-dead-code-removal"], "handoff": { "from": "test-driven-development", "to": "refactoring-and-dead-code-removal" } },
    { "id": "refactor-c08", "split": "validation", "kind": "near-miss", "prompt": "The mechanical refactor is incomplete and suspected dead code is not proven unused; finish the behavior-preserving refactor before review.", "expected": ["refactoring-and-dead-code-removal"], "excluded": ["code-review"], "handoff": { "from": "refactoring-and-dead-code-removal", "to": "code-review" } },
    { "id": "refactor-c09", "split": "validation", "kind": "near-miss", "prompt": "Review this implementation because required correctness findings remain unresolved; do not claim fresh evidence yet.", "expected": ["code-review"], "excluded": ["verification-before-completion"], "handoff": { "from": "code-review", "to": "verification-before-completion" } },
    { "id": "refactor-c10", "split": "validation", "kind": "negative", "prompt": "Design a customer onboarding campaign and write the launch announcement.", "expected": [], "excluded": ["codebase-exploration", "test-driven-development", "refactoring-and-dead-code-removal", "code-review", "verification-before-completion"], "handoff": null }
  ]
}
